{
  "schema_version": "v1",
  "request_id": "13131313-1313-4313-8313-131313131313",
  "tenant_id": "11111111-1111-4111-8111-111111111111",
  "workflow_version_id": "14141414-1414-4414-8414-141414141414",
  "action": "record_review",
  "decision": "recommended_for_approval",
  "notes": "La evidencia, las limitaciones y los gaps fueron revisados por una persona distinta de la autora.",
  "provenance": {
    "credential_id": "33333333-3333-4333-8333-333333333333"
  }
}
